<?xml version="1.0" encoding="UTF-8"?>

<!--
    Document   : disambiguationRules.xml
    Created on : July 21, 2006, 12:16 PM
    Author     : Turhan O. Daybelge
    Description: This document contains the Disambiguation Rules that are used by the Morphological Disambiguator.
-->

<disambiguationRules xmlns:xsi='http://www.w3.org/2001/XMLSchema-instance' xsi:noNamespaceSchemaLocation='disambiguationRules.xsd'>
    <chooseRule>
        <neighbour offset="1"><parse>Conj</parse></neighbour>
        <target><token>ki</token><parse>Conj</parse></target>
    </chooseRule>
    <!--  Rules for handling word "var"  //-->
    <chooseRule>
        <neighbour offset="1"><parse>Punc</parse></neighbour>
        <target><token>var</token><parse>Noun</parse></target>
    </chooseRule>
    <chooseRule>
        <neighbour offset="1"><parse>Punc</parse></neighbour>
        <target><token>vardır</token><parse>Noun^DB+Verb</parse></target>
    </chooseRule>
    <chooseRule>
        <neighbour offset="-1"><parse>Nom</parse></neighbour>
        <neighbour offset="1"><parse>Punc</parse></neighbour>
        <target><token>vardı</token><parse>Noun^DB+Verb</parse></target>
    </chooseRule>
    <chooseRule>
        <neighbour offset="-1"><parse>de+Conj</parse></neighbour>
        <neighbour offset="1"><parse>Punc</parse></neighbour>
        <target><token>vardı</token><parse>Noun^DB+Verb</parse></target>
    </chooseRule>
    <chooseRule>
        <neighbour offset="-1"><parse>Nom</parse></neighbour>
        <target><token>varmış</token><parse>Noun^DB+Verb</parse></target>
    </chooseRule>
    <chooseRule>
        <neighbour offset="-1"><parse>Nom</parse></neighbour>
        <target><token>varsa</token><parse>Noun^DB+Verb</parse></target>
    </chooseRule>
    <chooseRule>
        <neighbour offset="1" lastOfSentence="true"><parse>Punc</parse></neighbour>
        <target><token>var</token><parse>Noun</parse></target>
    </chooseRule>
    <!--  Rules for handling word "değil"  //-->
    <chooseRule>
        <neighbour offset="1"><parse>Punc</parse></neighbour>
        <target><token>değil</token><parse>Noun</parse></target>
    </chooseRule>
    <chooseRule>
        <neighbour offset="1"><parse>Punc</parse></neighbour>
        <target><token>değildir</token><parse>Noun^DB+Verb</parse></target>
    </chooseRule>
    <chooseRule>
        <neighbour offset="-1"><parse>Nom</parse></neighbour>
        <neighbour offset="1"><parse>Punc</parse></neighbour>
        <target><token>değildi</token><parse>Noun^DB+Verb</parse></target>
    </chooseRule>
    <chooseRule>
        <neighbour offset="-1"><parse>de+Conj</parse></neighbour>
        <neighbour offset="1"><parse>Punc</parse></neighbour>
        <target><token>değildi</token><parse>Noun^DB+Verb</parse></target>
    </chooseRule>
    <chooseRule>
        <neighbour offset="-1"><parse>Nom</parse></neighbour>
        <target><token>değilmiş</token><parse>Noun^DB+Verb</parse></target>
    </chooseRule>
    <chooseRule>
        <neighbour offset="-1"><parse>Nom</parse></neighbour>
        <target><token>değilse</token><parse>Noun^DB+Verb</parse></target>
    </chooseRule>
    <chooseRule>
        <target firstOfSentence="true"><parse>Conj</parse></target>
    </chooseRule>
    <!--  Rules for handling word "ol"  //-->
    <chooseRule>
        <neighbour offset="-1"><parse>Adj</parse></neighbour>
        <target><token>olan</token><parse>Adj</parse></target>
    </chooseRule>
    <chooseRule>
        <neighbour offset="-1"><parse>Adj</parse></neighbour>
        <target><token>olmak</token><parse>Noun</parse></target>
    </chooseRule>
    <chooseRule>
        <neighbour offset="-1"><parse>Adj</parse></neighbour>
        <target><token>olmuştur</token><parse>Verb</parse></target>
    </chooseRule>
    <chooseRule>
        <neighbour offset="-1"><parse>Adj</parse></neighbour>
        <target><token>oldu</token><parse>Verb</parse></target>
    </chooseRule>
    <chooseRule>
        <neighbour offset="-1"><parse>Adj</parse></neighbour>
        <target><token>ol</token><parse>Verb</parse></target>
    </chooseRule>
    <chooseRule>
        <neighbour offset="-1"><parse>Adj</parse></neighbour>
        <target><parse>ol+Verb^DB+Adj+PresPart</parse></target>
    </chooseRule>
    <chooseRule>
        <neighbour offset="-1"><parse>Adj</parse></neighbour>
        <target><parse>ol+Verb^DB+Noun+Inf</parse></target>
    </chooseRule>
    <chooseRule>
        <neighbour offset="-1"><parse>Adj</parse></neighbour>
        <target><parse>ol+Verb^DB+Noun+PastPart+Abl</parse></target>
    </chooseRule>
    <chooseRule>
        <neighbour offset="-1"><parse>Adj</parse></neighbour>
        <target><parse>ol+Verb^DB+Noun+PastPart+Acc</parse></target>
    </chooseRule>
    <chooseRule>
        <neighbour offset="-1"><parse>Adj</parse></neighbour>
        <target><parse>ol+Verb^DB+Noun+FutPart+Abl</parse></target>
    </chooseRule>
    <chooseRule>
        <neighbour offset="-1"><parse>Adj</parse></neighbour>
        <target><parse>ol+Verb^DB+Noun+FutPart+Acc</parse></target>
    </chooseRule>
    <chooseRule>
        <neighbour offset="-1"><parse>Nom</parse></neighbour>
        <target><token>olan</token><parse>Adj</parse></target>
    </chooseRule>
    <chooseRule>
        <neighbour offset="-1"><parse>Nom</parse></neighbour>
        <target><token>olmak</token><parse>Noun</parse></target>
    </chooseRule>
    <chooseRule>
        <neighbour offset="-1"><parse>Nom</parse></neighbour>
        <target><token>olmuştur</token><parse>Verb</parse></target>
    </chooseRule>
    <chooseRule>
        <neighbour offset="-1"><parse>Nom</parse></neighbour>
        <target><token>oldu</token><parse>Verb</parse></target>
    </chooseRule>
    <chooseRule>
        <neighbour offset="-1"><parse>Nom</parse></neighbour>
        <target><parse>ol+Verb</parse></target>
    </chooseRule>
    <chooseRule>
        <neighbour offset="-1"><parse>Nom</parse></neighbour>
        <target><parse>ol+Verb^DB+Adj+PresPart</parse></target>
    </chooseRule>
    <chooseRule>
        <neighbour offset="-1"><parse>Nom</parse></neighbour>
        <target><parse>ol+Verb^DB+Noun+Inf</parse></target>
    </chooseRule>
    <!--  Rules for numeric tokens  //-->
    <chooseRule>
        <neighbour offset="-2"><parse>Num+Card</parse></neighbour>
        <neighbour offset="-1"><parse>Num+Card</parse></neighbour>
        <neighbour offset="1"><parse>Num+Card</parse></neighbour>
        <target><parse>Num+Card</parse></target>
    </chooseRule>
    <chooseRule>
        <neighbour offset="-1"><parse>Num+Card^DB+Noun+Pnon+Loc</parse></neighbour>
        <target><parse>Num+Card^DB+Noun</parse></target>
    </chooseRule>
    <!--  Rules for handling tokens related to date  //-->
    <chooseRule>
        <neighbour offset="-1"><parse>Date</parse></neighbour>
        <target><token>günü</token><parse>Noun+A3sg+P3sg+Nom</parse></target>
    </chooseRule>
    <chooseRule>
        <neighbour offset="-1"><parse>Date</parse></neighbour>
        <target><token>günlü</token><parse>Adj</parse></target>
    </chooseRule>
    <chooseRule>
        <neighbour offset="-1"><parse>Num+Card</parse></neighbour>
        <target><token>yılı</token><parse>Noun+P3sg+Nom</parse></target>
    </chooseRule>
    <chooseRule>
        <neighbour offset="-1"><parse>Num+Card</parse></neighbour>
        <target><token>yılında</token><parse>Noun+P3sg+Loc</parse></target>
    </chooseRule>
    <chooseRule>
        <neighbour offset="-1"><parse>Num+Card</parse></neighbour>
        <target><token>yılından</token><parse>Noun+P3sg+Abl</parse></target>
    </chooseRule>
    <chooseRule>
        <neighbour offset="-1"><parse>Num+Card</parse></neighbour>
        <target><token>yılının</token><parse>Noun+P3sg+Gen</parse></target>
    </chooseRule>
    <!--  Choose the adjectival reading to the verbal reading,   //-->
    <!--  if the next token is a verb  //-->
    <chooseRule>
        <neighbour offset="-1"><parse>Verb+Narr^DB+Adj</parse></neighbour>
        <target><parse>Verb+Pres</parse></target>
    </chooseRule>
    <chooseRule>
        <neighbour offset="-1"><parse>Verb+Narr^DB+Adj</parse></neighbour>
        <target><parse>Verb+Past</parse></target>
    </chooseRule>
    <chooseRule>
        <neighbour offset="-1"><parse>Verb+Narr^DB+Adj</parse></neighbour>
        <target><parse>Verb+Fut</parse></target>
    </chooseRule>
    <chooseRule>
        <neighbour offset="-1"><parse>Verb+Narr^DB+Adj</parse></neighbour>
        <target><parse>Verb+Narr</parse></target>
    </chooseRule>
    <chooseRule>
        <neighbour offset="-1"><parse>Verb+Narr^DB+Adj</parse></neighbour>
        <target><parse>Verb+Neces</parse></target>
    </chooseRule>
    <chooseRule>
        <neighbour offset="-1"><parse>Verb+Narr^DB+Adj</parse></neighbour>
        <target><parse>PastPart</parse></target>
    </chooseRule>
    <!--  Rules for omitting the very infrequent readings for:  //-->
    <!--  For example "ama" is also a noun, and "de" is a verb  //-->
    <chooseRule>
        <target><parse>ama+Conj</parse></target>
    </chooseRule>
    <chooseRule>
        <target><parse>de+Conj</parse></target>
    </chooseRule>
    <chooseRule>
        <target><parse>ya+Conj</parse></target>
    </chooseRule>
    <chooseRule>
        <target><parse>hatta+Conj</parse></target>
    </chooseRule>
    <chooseRule>
        <target><token>aslında</token><parse>Adverb</parse></target>
    </chooseRule>
    <chooseRule>
        <target><token>artık</token><parse>Adverb</parse></target>
    </chooseRule>
    <chooseRule>
        <target><token>yalnız</token><parse>Adverb</parse></target>
    </chooseRule>
    <chooseRule>
        <target><token>öylesine</token><parse>Adverb</parse></target>
    </chooseRule>
    <chooseRule>
        <target><parse>diye+Postp+PCNom</parse></target>
    </chooseRule>
    <chooseRule>
        <target><token>hala</token><parse>Adverb</parse></target>
    </chooseRule>
    <chooseRule>